{
  "id": "villagers",
  "order": 2,
  "era": 1,
  "capacity": 10,
  "advanceFrom": "settlers",
  "upgradeCost": { "timber": 2 },
  "basicNeeds": {
    "goods": { "fish": 3, "homespun": 3, "bread": 5 },
    "services": ["market", "shrine"]
  },
  "comfortNeeds": {
    "cider": 2,
    "pottery": 1.5
  },
  "outputs": { "knowledge": 10 },
  "start": true
}
