{
  "id": "villagers",
  "order": 2,
  "era": 1,
  "capacity": 10,
  "advanceFrom": "settlers",
  "upgradeCost": { "timber": 2 },
  "basicNeeds": {
    "goods": { "fish": 4, "wood": 4 },
    "services": ["market"]
  },
  "comfortNeeds": { "cider": 2 },
  "outputs": { "knowledge": 10 },
  "start": true
}
